{"id": "bda73635-fc7e-44a3-8b6f-4f1df16c3d88", "created_at": 1773055053.5470731, "user_id": "1", "dataset_name": "medic_eval.jsonl", "dataset_total_lines": 3, "dataset_used_lines": 1, "dataset_size": 485, "workspace": "eval_ws", "retrieval_mode": "vector_only", "max_retrieval_docs": 3, "collection_id": "kb18_1766680843747", "limit": 1, "result": {"summary": {"context_precision": 0.0, "context_recall": 0.0, "answer_relevancy": 0.0, "faithfulness": 0.6666666666666666}, "items": [{"question": "RAG系统的主要目标是什么？", "reference": "RAG系统的主要目标是结合检索与生成，在回答中利用外部知识以提高准确性与可解释性。", "answer": "未在给定上下文中找到答案", "contexts": ["RetrievedDocument(page_content='DKD的药物治疗目标主要是延缓肾脏病的进展和降低心血管并发症的发生，目前有循证医学证据的药物干预模式包括：①严格的血压控制[<130/80 mmHg(1 mmHg=0.133 kPa)]; ②足量的肾素-血管紧张素-醛固酮系统抑制剂（renin-angiotensinaldosterone system inhibitor, RAASi), 如血管紧张素转换酶抑制剂（angiotensin converting enzyme inhibitors, ACEI)或血管紧张素Ⅱ受体拮抗剂(angiotensin II receptor blocker, ARB)类药物；③钠-葡萄糖共转运蛋白2抑制剂(sodium-glucose cotransporter-2 inhibitor, SGLT2i); ④长效胰高糖素样肽-1受体激动剂（glucagon-like peptide-1 receptor agonists, GLP-1 RA); ⑤高选择性非甾体盐皮质激素受体拮抗剂(nonsteroidal mineralocorticoid receptor antagonists, ns-MRA), 这些药物均有较为明确的证据显示可以显著降低蛋白尿和延缓肾功能下降的进展, 同时可以显著减少心血管并发症的发生。', metadata={'document_name': '中国糖尿病肾脏病基层管理指南.md', 'chunk_index': 5, 'chunk_size': 560, 'pk': '26646dcc-1689-457a-aaa6-a7d02034e58f'})", "RetrievedDocument(page_content='全科医生是社区居民健康的“守门人”，不仅承担着基层糖尿病及其并发症管理的重任，同时也为糖尿病专科与肾脏病专科、其他慢性病专科之间的交流沟通搭建了桥梁。基层医疗卫生机构依托分级诊疗政策，联合专科医护团队交叉管理，整合信息化管理模式，共同提高DKD患者整体预后。为了提高社区基层医生肾脏疾病诊治的能力，建议有条件的基层医疗卫生机构开展基于互联网、人工智能技术及大数据的临床决策支持系统（clinical decision support system，CDSS）管理模式的研究。  \\n糖尿病患者的自我管理教育和支持(diabetes self-management education and support, DSMES)应贯穿整个病程，以利于改善医疗效果，提升患者心理健康、自我满意度，获得幸福感。我国DSMES在规范性和可操作性方面仍存在一定的不足，患者被动学习的现象较为普遍。随着《中国2型糖尿病自我管理处方专家共识》的出台以及信息化和互联网技术的发展，借助电子病历记录(electric health record，EHR)平台，DSMES可带来临床、社会心理和行为、医疗成本等多方面获益，也需要探索适合我国国情的DSMES体系并普及至基层医疗卫生机构及居民家庭中，使之成为常态化的糖尿病患者自我管理模式。', metadata={'document_name': '中国糖尿病肾脏病基层管理指南.md', 'chunk_index': 11, 'chunk_size': 556, 'pk': '029807da-52f0-4d63-bb25-8461ea7474b0'})", "RetrievedDocument(page_content='对于DKD伴有蛋白尿患者强化降压至<130/80 mmHg，可以进一步减少27%的肾衰竭风险以及14%的心血管并发症风险。2021年KDIGO指南推荐肾脏病患者血压控制目标为收缩压<120 mmHg，但是该标准仅基于收缩压的干预研究（systolic blood pressure intervention trial, SPRINT)，由于SPRINT纳入的肾脏病患者不包含糖尿病患者，并且该血压目标是基于标准条件下血压测量而非常规诊室血压，在实际临床实践中难以实施且难以达到，因此综合考虑现有证据，本指南与美国糖尿病协会(American Diabetes Association, ADA)的糖尿病指南、全球高血压实践指南、美国成人高血压管理指南、中国高血压指南一致，推荐UACR>30 mg/g的DKD患者血压控制目标值为<130/80 mmHg；并且，全科医生应根据患者年龄、合并症、耐受程度与患者充分沟通后共同制定降压目标，对不能耐受该目标值的患者需实施个体化降压。基层管理DKD合并高血压的患者可参考高血压的治疗推荐(图2)。  \\n建议7：强化降压目标，血压控制于<130/80 mmHg（证据等级B，推荐强度1）。  \\n图2糖尿病合并高血压患者的降压治疗推荐流程图\\n![](images/ded9d216e07dc9d36f1497c665fbc4441cb5f88695bc7f44eb19c2452c67370e.jpg)\\n注：ACEI血管紧张素转换酶抑制剂；ARB血管紧张素Ⅱ受体拮抗剂；CCB钙离子通道阻滞剂；1mmHg=0.133kPa', metadata={'document_name': '中国糖尿病肾脏病基层管理指南.md', 'chunk_index': 6, 'chunk_size': 681, 'pk': 'd4b511d1-1b31-4c96-b0b7-e0c1a977fbe3'})", "RetrievedDocument(page_content='1.RAASi:基于119个临床试验和64768例慢性肾脏病患者的Meta分析显示，无论ACEI或ARB类药物均可显著减少慢性肾脏病患者的心血管疾病风险和肾衰竭风险。有关氯沙坦肾脏保护研究(reduction of endpoints in NIDDM with the angiotensin II antagonist losartan, RENAL)的两项RCT研究均显示ARB类药物具有独立于降低血压以外的肾脏保护效应，而Meta分析显示ACEI和ARB类药物对DKD患者降低白蛋白尿的效果相当。也有少数临床试验显示对于糖尿病合并高血压的患者，应用ACEI或ARB类药物可以显著减少新发微量或显性白蛋白尿的发生，起到一定的预防肾脏病发生的作用。虽然RAAS双阻断治疗(ACEI或ARB类药物联合应用)与单药治疗相比可更为显著地降低白蛋白尿水平，但是在美国退伍军人的糖尿病肾脏病(Veterans Affairs Nephropathy in Diabetes,VANEPHRON-D)临床试验中发现，ARB和ACEI联合治疗较ARB单药治疗显著增加高钾血症和急性肾损伤的发生风险。同样，在以心肾为终点阿利吉仑治疗2型糖尿病的试验（Aliskiren trial in type 2 diabetes using cardiorenal endpoints, ALTITUDE）研究所纳入的DKD合并心血管疾病风险患者中发现，ACEI或ARB基础上联合肾素抑制剂阿利吉仑显著增加高钾血症风险并且不能减少心血管疾病或肾衰竭的风险。因此，目前不推荐ACEI、ARB、阿利吉仑类药物联合的阻断治疗。  \\n临床实践中为了提高RAASi的疗效和安全性，基层医生需要注意：  \\n(1)足量应用，即对于白蛋白尿患者应当逐渐加量至患者能耐受的最大剂量，或者说明书提示的最大剂量。\\n(2)为了最大发挥降低白蛋白尿的疗效，强调患者严格限制盐分摄入。\\n(3)RAASi通过抑制血管紧张素Ⅱ导致肾小球内压力下降，引起肾小球滤过率降低、血清肌酐水平升高，并且通过抑制醛固酮系统可导致血钾升高。因此，RAASi初始治疗或增加剂量的2~4周内以及长期使用过程中，需要定期监测血清肌酐、血钾水平。初始应用或增加剂量后，如果在1个月内血清肌酐水平升高幅度  $< 30\\\\%$  ，不建议停药。有研究表明，ACEI如果短期内引起血清肌酐水平较基线升高  $< 30\\\\%$  并在之后2个月内下降至稳定水平，则具有远期肾脏保护作用，因此短期内血清肌酐一定幅度内的升高不作为停药指征。若短期内血清肌酐升高  $\\\\geqslant 30\\\\%$  ，需要转诊至肾脏病专科评估潜在的影响因素如肾动脉狭窄、容量不足等。ACEI导致的血钾升高可以通过联合降钾药物控制血钾水平，而不是直接减少RAASi的剂量或停药，在高钾血症可控的情况下持续应用RAASi具有心肾保护作用。\\n(4)应当避免两种RAASi联合使用，与ACEI、ARB或直接肾素抑制剂联用并未显示出长期的心肾保护作用，反而增加高钾血症和急性肾损伤的发生率。\\n(5)DKD患者可能出现容量不足状态（如呕吐、腹泻、感染等）时，需要考虑暂时停用RAASi，以减少发生急性肾损伤的风险。\\n(6)对于有妊娠计划或已妊娠的患者避免使用ACEI。ACEI可能导致胎儿和新生儿不良结局，尤其是妊娠中晚期，对于妊娠早期的影响尚缺乏一致性意见。  \\n2.盐皮质激素受体拮抗剂(mineralocorticoid receptor antagonists，MRA)：经典MRA包括螺内酯、新型选择性MRA包括依普利酮，被既往研究证明可有效治疗难治性高血压并且降低DKD患者的蛋白尿水平，但是存在高钾血症和eGFR下降的不良反应，并且缺乏RCT研究对其长期有效性的观察。第3代高选择性ns-MRA的Ⅲ期临床试验非奈利酮在减少糖尿病肾脏病肾衰竭和疾病进展(Finerenone in Reducing Kidney Failure and Disease Progression in Diabetic Kidney Disease, FIDLIO-DKD)研究的结果显示，DKD患者在RAASi治疗基础上，非奈利酮可额外降低  $31\\\\%$  的白蛋白尿水平，并减少  $18\\\\%$  的肾功能下降的进展或肾衰竭导致的死亡风险。非奈利酮在降低糖尿病肾脏病患者的心血管原因死亡率和患病率(finerenone in reducing cardiovascular mortality and morbidity in diabetic kidney disease, FIGARO-DKD)研究表明，DKD患者应用非奈利酮治疗较安慰剂相比降低 $13\\\\%$  心血管事件，尤其是减少了  $29\\\\%$  的心力衰竭事件的发生。2022年ADA与KDIGO慢性肾脏病糖尿病管理联合共识报告指出，2型糖尿病和慢性肾脏病患者若已经接受最大耐受剂量的ACEI或ARB治疗，  $\\\\mathrm{eGFR}\\\\geqslant 25\\\\mathrm{ml}\\\\cdot \\\\mathrm{min}^{-1}\\\\cdot (1.73\\\\mathrm{m}^2)^{-1}$  、血钾水平正常（  $\\\\leqslant 5.0\\\\mathrm{mmol / L})$  、蛋白尿  $(\\\\mathrm{UACR}\\\\geqslant 30\\\\mathrm{mg / g})$  时，应考虑加用ns-MRA(如非奈利酮)以改善心血管预后以及降低慢性肾脏病进展的风险，治疗期间或剂量改变后4周内监测血钾，本指南遵循相同的推荐原则。  \\n建议8 强烈推荐糖尿病伴高血压或出现蛋白尿患者首选ACEI或ARB类药物治疗，缓慢增加至最大可耐受剂量，以降低蛋白尿水平和延缓肾功能下降的进展，并减少心血管并发症（证据等级B，推荐强度1）。  \\n建议9 不建议ACEI、ARB或肾素抑制剂阿利吉仑之间进行任何联合治疗（证据等级B，推荐强度1）。  \\n建议10 2型糖尿病患者  $\\\\mathrm{eGFR} \\\\geqslant 25 \\\\mathrm{ml} \\\\cdot \\\\mathrm{min}^{-1} \\\\cdot (1.73 \\\\mathrm{~m}^{2})^{-1}$  、血钾水平正常、UACR  $\\\\geqslant 30 \\\\mathrm{mg} / \\\\mathrm{g}$  、ACEI/ARB已达最大耐受剂量时，推荐应用对肾脏和心血管有益的ns-MRA(如非奈利酮)治疗(证据等级B，推荐强度1)。', metadata={'chunk_index': 7, 'chunk_size': 2727, 'document_name': '中国糖尿病肾脏病基层管理指南.md', 'pk': '10f25878-508e-407e-8e72-4af9d527f31e'})", "RetrievedDocument(page_content='1.SGLT2i：SGLT2i通过抑制肾小管上皮细胞基底膜上的SGLT2，特异性抑制肾脏重吸收葡萄糖，增加尿中葡萄糖的排出，从而降低血糖水平。需告知患者注意用药期间的不良反应，并随访评估药物潜在的不良反应，包括可能发生骨折、泌尿系统感染、生殖道感染、酮症酸中毒等。应用SGLT2i可使HbA1c下降  $0.5\\\\% \\\\sim 1.0\\\\%$  。此外，SGLT2i可能通过增加钠离子清除、渗透性利尿、降低交感神经系统功能、降低肾小球内压、抑制氧化应激等机制，起到保护心肾的作用。近年来，多项关于SGLT2i的多中心RCT研究相继发表，证实其对2型糖尿病和慢性肾脏病者具有独立于降低血糖之外的心肾保护作用。  \\n主要相关证据有：  \\n(1)恩格列净与2型糖尿病患者的心血管结局事件试验(Empagliflozin cardiovascular outcome event trial in type 2 diabetes mellitus patients, EMPA-REG)、卡格列净治疗的心血管评估研究（Canagliflozin cardiovascular assessment study, CANVAS)、达格列净对心血管事件的影响——心肌梗死溶栓(Dapagliflozin effect on cardiovascular events-thrombolysis in myocardial infarction 58,DECLARE-TIMI 58)研究，均证实了SGLT2i对2型糖尿病患者的心血管保护作用以及降低白蛋白尿水平、延缓肾功能下降的效应。\\n(2)上述3个RCT研究的Meta分析显示，不论是否存在动脉粥样硬化性心脏病或心力衰竭病史，SGLT2i可降低慢性肾脏病患者  $\\\\left[\\\\mathrm{eGFR}30\\\\sim 60\\\\mathrm{ml}\\\\cdot \\\\min^{-1}\\\\cdot (1.73\\\\mathrm{m}^2)^{-1}\\\\right]$  心力衰竭住院率，并且延缓肾脏疾病进展（降低蛋白尿水平和延缓eGFR下降）。\\n(3)卡格列净与确诊DKD患者肾脏事件的临床评估（Canagliflozin and renal events in diabetes with established nephropathy clinical evaluation, CREDENCE)研究证明，在充分的ACEI或ARB的治疗基础上，卡格列净  $100\\\\mathrm{mg}$  可平均降低  $31\\\\%$  的蛋白尿水平，并显著降低  $32\\\\%$  的终末期肾衰竭风险以及心血管事件风险。\\n(4)上述4个RCT研究的Meta分析得出在2型糖尿病合并  $\\\\mathrm{eGFR} > 30 \\\\mathrm{ml} \\\\cdot \\\\mathrm{min}^{-1} \\\\cdot (1.73 \\\\mathrm{~m}^{2})^{-1}$  慢性肾脏病患者中, SGLT2i治疗可减少  $35\\\\%$  的肾衰竭风险, 同时可降低急性肾损伤的发生风险。\\n(5)达格列净与慢性肾脏病不良结局的预防(Dapagliflozin and prevention of adverse outcomes in chronic kidney disease, DAPA-CKD)研究表明，达格列净  $10\\\\mathrm{mg / d}$  可显著降低肾脏复合终点事件(eGFR持续下降  $\\\\geq 50\\\\%$  ，终末期肾脏病，肾脏或心血管原因死亡)风险，这一效果在DKD及非DKD人群同样有效。\\n(6)达格列净和心力衰竭不良结局的预防(Dapagliflozin and prevention of adverse outcomes in heart failure, DAPA-HF)和恩格列净在慢性心力衰竭和射血分数降低患者中的结局试验(Empagliflozin outcome trial in patients with chronic heart failure and a reduced ejection fraction, EMPEROR-Reduced)两项RCT研究得到的结论是，在射血分数降低的心力衰竭患者无论是否合并2型糖尿病，SGLT2i可显著降低慢性肾脏病患者发生心力衰竭住院或心血管原因死亡的风险。\\n（7）正在开展的恩格列净保护心脏和肾脏的研究（study of heart and kidney protection with Empagliflozin, EMPA-KIDNEY)是以DKD人群包括  $\\\\mathrm{eGFR} < 20\\\\mathrm{ml}\\\\cdot \\\\mathrm{min}^{-1}\\\\cdot (1.73\\\\mathrm{m}^2)^{-1}$  者为研究对象、肾脏终点为主要结局的RCT研究，结果表明恩格列净将肾脏病进展或心血管原因死亡风险降低了  $28\\\\%$  使全因住院率降低  $14\\\\%$  （均  $P < 0.05$  ）。  \\n建议11 推荐DKD患者eGFR≥30ml·min-1·(1.73m²)-1并且伴有白蛋白尿时使用SGLT2i降低蛋白尿、延缓肾功能下降的进展，并减少心血管并发症的发生（证据等级B，推荐强度1）。  \\n2.GLP-1:GLP-1属于肠促胰素，其分泌受进食活动调节，具有葡萄糖浓度依赖性地刺激胰岛细胞分泌胰岛素的作用，并可延缓胃排空、抑制食欲、减轻体重。在2型糖尿病患者中，肠促胰素的效应可能降低或缺乏，应用长效GLP-1RA刺激肠促胰岛素通路，不仅改善血糖调节和HbA1c、降低血压、减轻体重，更重要的是可以发挥器官保护作用。以肾脏结局为次要终点的GLP-1RA系列RCT研究包括关于利拉鲁肽的 LEADER 研究、注射索玛鲁肽的 SUSTAIN-6 研究、杜拉鲁肽的 REWIND 研究、杜拉鲁肽的 AWARD 研究, 均显示 GLP-1 RA 具有肾脏保护作用。2019 年发表的纳入 7 项关于 GLP-1RA 改善 2 型糖尿病患者心血管结局、死亡率、肾脏结局的 RCT 研究 (利司那肽的 ELIXA 研究、LEADER、SUSTAIN-6、艾塞那肽的 EXSCEL 研究、关于阿必鲁肽的 HARMONY 研究、REWIND、口服索马鲁肽的 PIONEER 6 研究) 的 Meta 分析显示, GLP-1 RA 可降低肾脏复合终点, 主要是降低蛋白尿事件的风险。关于注射型索玛鲁肽在 DKD 患者 [eGFR 25~75 ml·min⁻¹·(1.73 m²)⁻¹ 或 UACR 100~5000 mg/g] 以肾脏结局为主要终点的司美格鲁肽治疗糖尿病肾脏病 RCT 研究 (a research study to see how Semaglutide works compared to placebo in people with type 2 diabetes and chronic kidney disease, FLOW; 注册号 NCT03819153) 即将揭晓, 有望获得更多的肾脏保护证据。  \\n有关DKD患者降糖药物的特性以及根据eGFR水平调整药物用量的调整见图3、4，具体应用原则可参照相关的糖尿病临床实践指南。  \\n建议12 对于DKD患者使用二甲双胍联合SGLT2i血糖仍未达标或不能耐受上述药物时，推荐使用具有延缓DKD进展证据的GLP-1RA，可以一定程度地减少肾脏事件(证据等级B，推荐强度1)。  \\n<table><tr><td>药物</td><td>CKD进展</td><td>ASCVD</td><td>心力衰竭</td><td>降糖效力</td><td>低血糖风险</td><td>体重</td><td>费用</td></tr><tr><td>二甲双胍</td><td>中性</td><td>潜在获益</td><td>潜在获益</td><td>高</td><td>低</td><td>中性</td><td>低</td></tr><tr><td>SGLT2i</td><td>获益a</td><td>获益c</td><td>获益</td><td>中等</td><td>低</td><td>减重</td><td>高</td></tr><tr><td>GLP-1RA</td><td>获益b</td><td>获益c</td><td>潜在获益</td><td>高</td><td>低</td><td>减重</td><td>高</td></tr><tr><td>DPP-4i</td><td>中性</td><td>中性</td><td>潜在风险(沙格列汀)</td><td>中等</td><td>低</td><td>中性</td><td>高</td></tr><tr><td rowspan=\"2\">胰岛素</td><td rowspan=\"2\">中性</td><td rowspan=\"2\">中性</td><td rowspan=\"2\">中性</td><td rowspan=\"2\">最高</td><td rowspan=\"2\">高</td><td rowspan=\"2\">增重</td><td>高(类似物)</td></tr><tr><td>低(人)</td></tr><tr><td>磺脲类</td><td>中性</td><td>中性</td><td>中性</td><td>高</td><td>高</td><td>增重</td><td>低</td></tr><tr><td>噻唑烷二酮类</td><td>中性</td><td>潜在获益(吡格列酮)</td><td>风险增加</td><td>高</td><td>低</td><td>增重</td><td>低</td></tr><tr><td>α-糖苷酶抑制剂</td><td>中性</td><td>中性</td><td>中性</td><td>中等</td><td>低</td><td>中性</td><td>低</td></tr><tr><td colspan=\"6\">■中性</td><td colspan=\"2\">■潜在风险或高费用</td></tr><tr><td colspan=\"6\">■潜在益处或中等降糖功效</td><td colspan=\"2\">■不良反应风险增加</td></tr><tr><td colspan=\"8\">■益处(器官保护、高效、低血糖风险低、体重减轻或成本低)</td></tr></table>  \\n注：SGLT2i钠-葡萄糖共转运蛋白2抑制剂；GLP-1RA胰高糖素样肽-1受体激动剂；DPP-4i二肽基肽酶4抑制剂；CKD慢性肾脏病；ASCVD动脉粥样硬化性心脏病； ${}^{\\\\mathrm{a}}$  一级和二级研究证据证实获益； ${}^{\\\\mathrm{b}}$  二级证据证实获益； ${}^{\\\\mathrm{c}}$  药物具有特异性  \\n图3 糖尿病肾脏病患者选择降糖药物时的特性参考  \\n图4 肾功能  $\\\\mathrm{eGFR} < 45\\\\mathrm{ml}\\\\cdot \\\\mathrm{min}^{-1}\\\\cdot (1.73\\\\mathrm{m}^2)^{-1}$  时降糖药物剂量的调整建议\\n![](images/962fc85aa057e5bd894af690bddf6538edd8ac1f5b072ba674dd2433e21a979e.jpg)\\n注：eGFR估算的肾小球滤过率；SGLT2i钠-葡萄糖共转运蛋白2抑制剂；GLP-1RA胰高糖素样肽-1受体激动剂；DPP-4i二肽基肽酶4抑制剂； $^{\\\\mathrm{a}}$  SGLT2i降糖效力随着肾功能下降而降低，但有心身获益的证据； $^{\\\\mathrm{b}}$  度拉糖肽、利拉鲁肽、司美格鲁肽在大型心血管临床结局试验中已证明其心血管获益； $^{\\\\mathrm{c}}$  达格列净(10mg、1次/d)被批准应用于eGFR为  $25\\\\sim < 45 \\\\mathrm{ml}\\\\cdot \\\\mathrm{min}^{-1}\\\\cdot (1.73 \\\\mathrm{~m}^2)^{-1}$  的情况； $^{\\\\mathrm{d}}$  不推荐eGFR<30ml·min-1·(1.73m²)-1时作为降糖药物，心力衰竭并eGFR<20ml·min-1·(1.73m²)-1时不推荐使用。', metadata={'document_name': '中国糖尿病肾脏病基层管理指南.md', 'chunk_index': 8, 'chunk_size': 5177, 'pk': '554e50be-a238-480b-9b6c-42a6b12b2f0d'})"], "contexts_count": 5, "contexts_preview": ["RetrievedDocument(page_content='DKD的药物治疗目标主要是延缓肾脏病的进展和降低心血管并发症的发生，目前有循证医学证据的药物干预模式包括：①严格的血压控制[<130/80 mmHg(1 mmHg=0.133 kPa)]; ②足量的肾素-血管紧张素-醛固酮系统抑制剂（renin-angiotensinaldosterone system inhibitor, RAASi), 如血管紧张素转换酶抑制剂（angiotensin converting enzyme inhibitors, ACEI)或血管紧张素Ⅱ受体拮抗剂(angiotensin II receptor", "RetrievedDocument(page_content='全科医生是社区居民健康的“守门人”，不仅承担着基层糖尿病及其并发症管理的重任，同时也为糖尿病专科与肾脏病专科、其他慢性病专科之间的交流沟通搭建了桥梁。基层医疗卫生机构依托分级诊疗政策，联合专科医护团队交叉管理，整合信息化管理模式，共同提高DKD患者整体预后。为了提高社区基层医生肾脏疾病诊治的能力，建议有条件的基层医疗卫生机构开展基于互联网、人工智能技术及大数据的临床决策支持系统（clinical decision support system，CDSS）管理模式的研究。  \\n糖尿病患者的自我管理教育和支持(diabetes se", "RetrievedDocument(page_content='对于DKD伴有蛋白尿患者强化降压至<130/80 mmHg，可以进一步减少27%的肾衰竭风险以及14%的心血管并发症风险。2021年KDIGO指南推荐肾脏病患者血压控制目标为收缩压<120 mmHg，但是该标准仅基于收缩压的干预研究（systolic blood pressure intervention trial, SPRINT)，由于SPRINT纳入的肾脏病患者不包含糖尿病患者，并且该血压目标是基于标准条件下血压测量而非常规诊室血压，在实际临床实践中难以实施且难以达到，因此综合考虑现有证据，本指南与美国糖尿病协会(Ameri"], "metrics": {"context_precision": 0.0, "context_recall": 0.0, "answer_relevancy": 0.0, "faithfulness": 0.6666666666666666}}], "elapsed_ms": 31697, "total": 1, "warning": null}}
